{
  "$schema": "https://json-schema.org/draft/2020-12/schema",
  "title": "Owlshift ticket plan",
  "description": "A ticket's plan, in [`PLAN_FILE`](crate::refs::PLAN_FILE): the latest\nplan of its design runs, the text and the base commit it was written on,\nand the decider's approval once given.",
  "type": "object",
  "properties": {
    "approval": {
      "description": "The decider's approval, once given.",
      "anyOf": [
        {
          "$ref": "#/$defs/KeptApproval"
        },
        {
          "type": "null"
        }
      ]
    },
    "base": {
      "description": "The base commit the plan was written on, a full commit id.",
      "type": "string"
    },
    "format": {
      "description": "The format version of this document.",
      "type": "integer",
      "const": 1
    },
    "plan": {
      "$ref": "#/$defs/Plan"
    },
    "published": {
      "description": "The plan as last published in the ticket's document (OWL-350), once\none was: kept across the plans of later design runs, so that each\nPLAN comment updates the same document and says what changed.",
      "anyOf": [
        {
          "$ref": "#/$defs/PublishedPlan"
        },
        {
          "type": "null"
        }
      ]
    },
    "text_sha256": {
      "description": "The SHA-256 of the ticket's title, a NUL byte and its description,\nas 64 lowercase hexadecimal digits, as `intake.json` keeps it.",
      "type": "string",
      "pattern": "^[0-9a-f]{64}$"
    }
  },
  "additionalProperties": false,
  "required": [
    "format",
    "plan",
    "text_sha256",
    "base"
  ],
  "$defs": {
    "Alternative": {
      "description": "An approach the plan set aside.",
      "type": "object",
      "properties": {
        "approach": {
          "type": "string"
        },
        "reason": {
          "description": "Why it was set aside.",
          "type": "string"
        }
      },
      "additionalProperties": false,
      "required": [
        "approach",
        "reason"
      ]
    },
    "Fork": {
      "description": "A fork of the plan: its choice, the options it chose among, and why.",
      "type": "object",
      "properties": {
        "choice": {
          "type": "string"
        },
        "options": {
          "type": "array",
          "items": {
            "type": "string"
          },
          "minItems": 1
        },
        "reason": {
          "type": "string"
        }
      },
      "additionalProperties": false,
      "required": [
        "choice",
        "options",
        "reason"
      ]
    },
    "KeptApproval": {
      "description": "The decider's approval of a plan.",
      "type": "object",
      "properties": {
        "comment": {
          "description": "The tracker's identifier of the comment that approved it: the\ndecider's, or the approval round's own when the decider answered it\nwith a thumbs-up (OWL-371), or, when the resolver decided the\napproval (OWL-343), or a change Design applied with no review pass\n(OWL-463), its DECISION comment, kept with the decision in\n`questions.json`.",
          "type": "string",
          "pattern": "\\S"
        },
        "plan_sha256": {
          "description": "The SHA-256 of the approved plan's [`Plan::canonical`] text, as 64\nlowercase hexadecimal digits: a Build runs only on a plan with this\nhash when approval is required (OWL-32).",
          "type": "string",
          "pattern": "^[0-9a-f]{64}$"
        }
      },
      "additionalProperties": false,
      "required": [
        "comment",
        "plan_sha256"
      ]
    },
    "Plan": {
      "description": "The plan a design run returns (architecture section 5, \"Design\"): what\nthe Build follows and the reviewers read. Every text is not blank.",
      "type": "object",
      "properties": {
        "alternatives": {
          "description": "The approaches set aside, each with why.",
          "type": "array",
          "default": [],
          "items": {
            "$ref": "#/$defs/Alternative"
          }
        },
        "approach": {
          "description": "The approach chosen.",
          "type": "string"
        },
        "criteria": {
          "description": "The success criteria, taken from the ticket.",
          "type": "array",
          "items": {
            "type": "string"
          },
          "minItems": 1
        },
        "files": {
          "description": "The files the work touches, from the repository's root.",
          "type": "array",
          "default": [],
          "items": {
            "type": "string"
          }
        },
        "forks": {
          "description": "The choices of how the design made between approaches that would\neach deliver the ticket; `on-fork` plan approval reads them.",
          "type": "array",
          "default": [],
          "items": {
            "$ref": "#/$defs/Fork"
          }
        },
        "goal": {
          "description": "What the ticket's work achieves.",
          "type": "string"
        },
        "out_of_scope": {
          "type": "array",
          "default": [],
          "items": {
            "type": "string"
          }
        },
        "risks": {
          "type": "array",
          "default": [],
          "items": {
            "type": "string"
          }
        },
        "steps": {
          "description": "The ordered steps, each with its test.",
          "type": "array",
          "items": {
            "$ref": "#/$defs/PlanStep"
          },
          "minItems": 1
        }
      },
      "additionalProperties": false,
      "required": [
        "goal",
        "criteria",
        "approach",
        "steps"
      ]
    },
    "PlanChange": {
      "description": "What a PLAN comment says of its plan beside the version before\n(OWL-350).",
      "oneOf": [
        {
          "description": "The ticket's first published plan.",
          "type": "object",
          "properties": {
            "kind": {
              "type": "string",
              "const": "first"
            }
          },
          "additionalProperties": false,
          "required": [
            "kind"
          ]
        },
        {
          "description": "A new version: these parts differ from version `since`'s.",
          "type": "object",
          "properties": {
            "kind": {
              "type": "string",
              "const": "changed"
            },
            "parts": {
              "type": "array",
              "items": {
                "$ref": "#/$defs/PlanPart"
              },
              "maxItems": 9,
              "minItems": 1
            },
            "since": {
              "type": "integer",
              "format": "uint32",
              "minimum": 1
            }
          },
          "additionalProperties": false,
          "required": [
            "kind",
            "since",
            "parts"
          ]
        },
        {
          "description": "The plan published again unchanged, after a later pass.",
          "type": "object",
          "properties": {
            "kind": {
              "type": "string",
              "const": "unchanged"
            }
          },
          "additionalProperties": false,
          "required": [
            "kind"
          ]
        }
      ]
    },
    "PlanPart": {
      "description": "A part of a [`Plan`], in the plan's order (OWL-350): what the PLAN\ncomment names when it says what changed since the previous version.",
      "type": "string",
      "enum": [
        "goal",
        "criteria",
        "approach",
        "steps",
        "forks",
        "alternatives",
        "files",
        "risks",
        "out_of_scope"
      ]
    },
    "PlanStep": {
      "description": "One step of a plan.",
      "type": "object",
      "properties": {
        "test": {
          "description": "The test that shows the step done.",
          "type": "string"
        },
        "what": {
          "type": "string"
        }
      },
      "additionalProperties": false,
      "required": [
        "what",
        "test"
      ]
    },
    "PublishedPlan": {
      "description": "The plan as last published in the ticket's document (OWL-350,\narchitecture section 5, \"Kept and shown\"), and what its PLAN comment\ntold. The approval never reads it: it binds the plan of [`TicketPlan`].",
      "type": "object",
      "properties": {
        "change": {
          "description": "What its PLAN comment said changed.",
          "$ref": "#/$defs/PlanChange"
        },
        "document": {
          "description": "The tracker's identifier of the document, which the next PLAN\ncomment updates.",
          "type": "string",
          "pattern": "\\S"
        },
        "parts": {
          "description": "The SHA-256 of each part's [`Plan::part_canonical`] text, in\n[`PlanPart::ALL`]'s order.",
          "type": "array",
          "items": {
            "type": "string"
          },
          "maxItems": 9,
          "minItems": 9
        },
        "pass": {
          "description": "The Design review pass whose end published it.",
          "type": "integer",
          "format": "uint32",
          "minimum": 1
        },
        "plan_sha256": {
          "description": "The SHA-256 of the published plan's [`Plan::canonical`] text.",
          "type": "string",
          "pattern": "^[0-9a-f]{64}$"
        },
        "url": {
          "description": "Where a person opens it, as the tracker gave it.",
          "type": [
            "string",
            "null"
          ]
        },
        "version": {
          "description": "The plan's version, from 1: one more each time a published plan's\nhash differs from the one before.",
          "type": "integer",
          "format": "uint32",
          "minimum": 1
        }
      },
      "additionalProperties": false,
      "required": [
        "document",
        "version",
        "pass",
        "plan_sha256",
        "parts",
        "change"
      ]
    }
  }
}
